{
  "$schema": "https://json-schema.org/draft/2020-12/schema",
  "$id": "cabinets.schema.json",
  "title": "Cabinets",
  "description": "Cabinet form factors (floor, tabletop, countertop, etc.)",
  "type": "array",
  "items": {
    "type": "object",
    "properties": {
      "slug": { "type": "string", "pattern": "^[a-z0-9]+(?:-[a-z0-9]+)*$" },
      "name": { "type": "string", "minLength": 1 },
      "display_order": { "type": "integer", "minimum": 0 },
      "description": { "type": "string" }
    },
    "required": ["slug", "name", "display_order", "description"],
    "additionalProperties": false
  }
}
