[
  {
    "slug": "pinball",
    "name": "Pinball",
    "display_order": 1,
    "description": "Pinball is a coin-operated game in which a player launches a steel ball onto a tilted playfield and attempts to score points by hitting targets, passing over switches, and landing in scoring features — then keeps the ball in play using one or more player-controlled flippers mounted near the bottom of the field. The flipper, introduced by Gottlieb's *Humpty Dumpty* in 1947, is the defining invention that separates pinball from its ancestors: for the first time, the player could act on the ball after launching it, transforming a game of aim into a game of reflexes, timing, and strategy.\n\nBefore the flipper, pinball machines were plunger-and-gravity affairs descended directly from bagatelle — the player's only influence was the strength and angle of the initial shot. The flipper changed everything. Within a few years, playfield design evolved to exploit the new mechanic: slingshots, pop bumpers, ramps, loops, drop targets, and multiball locks created an increasingly complex landscape of risk and reward. By the 1950s, pinball had established itself as a distinct medium with its own design language, its own culture, and its own ongoing argument about whether it was a game of skill or a game of chance.\n\nThat argument mattered. Pinball was banned in New York City from 1942 to 1976, and in other jurisdictions for similar periods, on the theory that it constituted gambling. The flipper was the industry's strongest counterargument — proof that the outcome depended on the player's ability, not blind luck. When Roger Sharpe demonstrated his skill before the New York City Council in 1976, calling his shot and making it, the ban was lifted. The game that emerged from prohibition went on to become the most enduring and culturally significant coin-operated amusement ever built."
  },
  {
    "slug": "bagatelle",
    "name": "Bagatelle",
    "display_order": 2,
    "description": "Bagatelle is a table game in which balls are launched up an inclined playing surface and fall by gravity into scoring holes, pockets, or channels arranged across the board. The player's only moment of control is the launch itself — the angle, the force, the release — after which the ball's fate belongs to gravity, friction, and the pins or obstacles planted in its path. There are no flippers, no bumpers, no second chances. The ball rolls, bounces, settles, and scores.\n\nThe game traces its origins to late eighteenth-century France, where it was played on wooden tables in aristocratic parlors and public houses alike. By the 1870s, spring-loaded plungers had replaced the cue sticks used to propel the ball, and by the early 1930s, American manufacturers had miniaturized the concept into coin-operated countertop machines that flooded Depression-era drugstores, speakeasies, and candy shops. The countertop bagatelle was the direct ancestor of the modern pinball machine — same tilted playfield, same plunger, same network of pins and scoring pockets — lacking only the flipper that would arrive in 1947 and transform the medium.\n\nIn pinball history, bagatelle occupies the position of a founding ancestor: the game that established the basic physical vocabulary — inclined plane, steel ball, spring launcher, obstacles, scoring targets — upon which everything that followed was built. A handful of coin-operated machines continued to use the bagatelle format well into the electromechanical era, typically as simpler, lower-cost alternatives to flipper games, and the format occasionally resurfaced as a playfield-within-a-playfield on full-sized pinball machines."
  },
  {
    "slug": "shuffle",
    "name": "Shuffle",
    "display_order": 3,
    "description": "Shuffle alleys are coin-operated amusement machines in which the player slides a puck or ball down a long, narrow, polished playing surface toward scoring zones at the far end. The format borrows its basic mechanics from tabletop shuffleboard and ten-pin bowling — the player's skill lies in controlling the force and angle of the delivery to land in high-value areas or knock down miniature pins. The playing surfaces were typically six to eight feet long, built into heavy wooden cabinets designed for bars, taverns, and bowling alleys.\n\nChicago Coin, United Manufacturing, and Williams were the dominant shuffle alley manufacturers through the 1950s and 1960s, producing machines in dozens of variations: bowling pin models with mechanical pin-setting mechanisms, target-score models with graduated point zones, and bank-shot models that rewarded precision angles. The games were engineered for the same coin-operated route as pinball machines and were often distributed by the same operators, but they occupied a different niche — slower-paced, social, suited to the after-work beer-and-a-game crowd rather than the arcade's rapid-fire pinball culture.\n\nShuffle alleys shared manufacturers, operators, and distribution networks with pinball, and their mechanical and electrical engineering drew from the same pool of relay logic and solenoid technology. They represent a parallel branch of the coin-operated amusement industry — one that thrived for decades alongside pinball before declining in the 1970s as solid-state electronics and video games reshaped the landscape of coin-op entertainment."
  },
  {
    "slug": "pitch-and-bat",
    "name": "Pitch and Bat",
    "display_order": 4,
    "description": "Pitch-and-bat machines are coin-operated baseball games in which a ball is mechanically pitched — rolled, launched, or dropped into play — and the player swings a bat mechanism to strike it onto a scoring playfield. The bat was typically controlled by a pull knob, a lever, or a trigger mounted on the front of the cabinet, and the timing of the swing determined where the ball landed: a well-timed hit might reach the back wall for a home run, while a mistimed swing produced a grounder that rolled into a low-scoring pocket or an out.\n\nWilliams was the most prolific manufacturer of pitch-and-bat games, producing titles from the 1950s through the 1970s that combined the physical satisfaction of hitting an actual ball with the scoring and replay mechanics of the coin-operated amusement industry. The playfield behind the bat was typically laid out to represent a baseball diamond, with scoring pockets or channels corresponding to singles, doubles, triples, home runs, and outs. Some models included mechanical fielder figures that moved to catch or deflect the batted ball.\n\nPitch-and-bat games occupied a niche alongside pinball in the operator's route — they appealed to the sports-bar crowd and to players who preferred the straightforward physical challenge of hitting a ball over the more abstract geometry of a pinball playfield. Like shuffle alleys, they shared the same manufacturing ecosystem and operator networks as pinball, and their gradual disappearance in the late 1970s and 1980s tracked the same industry-wide contraction that reduced the diversity of coin-operated amusements to pinball and video games."
  }
]
